{"protocol":"relay.run/v2","run_id":"R001-relay-dhr72-real-checkpoint-1-20260905","workflow_name":"relay/dhr72-real-checkpoint@1","summary":"DHR72 isolated Windows checkpoint proof","trigger":"system","created_at":"2026-09-05T07:22:43.6743673Z","labels":[{"key":"dhr72.profile","value":"herdr.codex.main"}],"nodes":[{"node_id":"real-product","title":"DHR72 real product node","role":"executor","required":true,"depends_on":[],"executor_profiles":[{"kind":"herdr-agent","ref":"herdr.codex.main"}]}]}